<?xml version="1.0"?>
<!DOCTYPE HPCToolkitExperiment [
<!-- ******************************************************************** -->
<!-- HPCToolkit Experiment DTD						  -->
<!-- Version 2.2							  -->
<!-- ******************************************************************** -->
<!ELEMENT HPCToolkitExperiment (Header, (SecCallPathProfile|SecFlatProfile)*)>
<!ATTLIST HPCToolkitExperiment
	  version CDATA #REQUIRED>

  <!-- ****************************************************************** -->

  <!-- Info/NV: flexible name-value pairs: (n)ame; (t)ype; (v)alue -->
  <!ELEMENT Info (NV*)>
  <!ATTLIST Info
	    n CDATA #IMPLIED>
  <!ELEMENT NV EMPTY>
  <!ATTLIST NV
	    n CDATA #REQUIRED
	    t CDATA #IMPLIED
	    v CDATA #REQUIRED>

  <!-- ****************************************************************** -->
  <!-- Header								  -->
  <!-- ****************************************************************** -->
  <!ELEMENT Header (Info*)>
  <!ATTLIST Header
	    n CDATA #REQUIRED>

  <!-- ****************************************************************** -->
  <!-- Section Header							  -->
  <!-- ****************************************************************** -->
  <!ELEMENT SecHeader (MetricTable?, MetricDBTable?, TraceDBTable?, LoadModuleTable?, FileTable?, ProcedureTable?, Info*)>

    <!-- MetricTable: -->
    <!ELEMENT MetricTable (Metric)*>

    <!-- Metric: (i)d; (n)ame -->
    <!--   o: metric sequence order (hpcrun metric order) -->
    <!--   md: metric description -->
    <!--   mp: metric parent ID   -->
    <!--   es: number of samples    (perf_events only) -->
    <!--   em: event multiplexed    (perf_events only) -->
    <!--   ep: average event period (perf_events only) -->
    <!--   (v)alue-type: transient type of values -->
    <!--   (t)ype: persistent type of metric      -->
    <!--   fmt: format; show; -->
    <!ELEMENT Metric (MetricFormula*, Info?)>
    <!ATTLIST Metric
	      i            CDATA #REQUIRED
	      o	           CDATA #IMPLIED
	      n            CDATA #REQUIRED
	      md	       CDATA #IMPLIED
	      mp	       CDATA #IMPLIED
	      es	       CDATA #IMPLIED
	      em	       CDATA #IMPLIED
	      ep	       CDATA #IMPLIED
	      v            (raw|final|derived-incr|derived) "raw"
	      t            (inclusive|exclusive|nil) "nil"
	      partner      CDATA #IMPLIED
	      fmt          CDATA #IMPLIED
	      show         (1|0) "1"
	      show-percent (1|0) "1">

    <!-- MetricFormula represents derived metrics: (t)ype; (frm): formula -->
    <!ELEMENT MetricFormula (Info?)>
    <!ATTLIST MetricFormula
	      t   (combine|finalize|view) "finalize"
	      i   CDATA #IMPLIED
	      frm CDATA #REQUIRED>

    <!-- Metric data, used in sections: (n)ame [from Metric]; (v)alue -->
    <!ELEMENT M EMPTY>
    <!ATTLIST M
	      n CDATA #REQUIRED
	      v CDATA #REQUIRED>

    <!-- MetricDBTable: -->
    <!ELEMENT MetricDBTable (MetricDB)*>

    <!-- MetricDB: (i)d; (n)ame -->
    <!--   (t)ype: persistent type of metric -->
    <!--   db-glob:        file glob describing files in metric db -->
    <!--   db-id:          id within metric db -->
    <!--   db-num-metrics: number of metrics in db -->
    <!--   db-header-sz:   size (in bytes) of a db file header -->
    <!ELEMENT MetricDB EMPTY>
    <!ATTLIST MetricDB
	      i              CDATA #REQUIRED
	      n              CDATA #REQUIRED
	      t              (inclusive|exclusive|nil) "nil"
	      partner        CDATA #IMPLIED
	      db-glob        CDATA #IMPLIED
	      db-id          CDATA #IMPLIED
	      db-num-metrics CDATA #IMPLIED
	      db-header-sz   CDATA #IMPLIED>

    <!-- TraceDBTable: -->
    <!ELEMENT TraceDBTable (TraceDB)>

    <!-- TraceDB: (i)d -->
    <!--   u: unit time of the trace (ms, ns, ..) -->
    <!--   db-min-time: min beginning time stamp (global) -->
    <!--   db-max-time: max ending time stamp (global) -->
    <!ELEMENT TraceDB EMPTY>
    <!ATTLIST TraceDB
	      i            CDATA #REQUIRED
	      u            CDATA #IMPLIED
	      db-glob      CDATA #IMPLIED
	      db-min-time  CDATA #IMPLIED
	      db-max-time  CDATA #IMPLIED
	      db-header-sz CDATA #IMPLIED>

    <!-- LoadModuleTable assigns a short name to a load module -->
    <!ELEMENT LoadModuleTable (LoadModule)*>

    <!ELEMENT LoadModule (Info?)>
    <!ATTLIST LoadModule
	      i CDATA #REQUIRED
	      n CDATA #REQUIRED>

    <!-- FileTable assigns a short name to a file -->
    <!ELEMENT FileTable (File)*>

    <!ELEMENT File (Info?)>
    <!ATTLIST File
	      i CDATA #REQUIRED
	      n CDATA #REQUIRED>

    <!-- ProcedureTable assigns a short name to a procedure -->
    <!ELEMENT ProcedureTable (Procedure)*>

    <!ELEMENT Procedure (Info?)>
    <!ATTLIST Procedure
	      i CDATA #REQUIRED
	      n CDATA #REQUIRED>

  <!-- ****************************************************************** -->
  <!-- Section: Call path profile					  -->
  <!-- ****************************************************************** -->
  <!ELEMENT SecCallPathProfile (SecHeader, SecCallPathProfileData)>
  <!ATTLIST SecCallPathProfile
	    i CDATA #REQUIRED
	    n CDATA #REQUIRED>

    <!ELEMENT SecCallPathProfileData (PF|M)*>
      <!-- Procedure frame -->
      <!--   (i)d: unique identifier for cross referencing -->
      <!--   (s)tatic scope id -->
      <!--   (n)ame: a string or an id in ProcedureTable -->
      <!--   (lm) load module: a string or an id in LoadModuleTable -->
      <!--   (f)ile name: a string or an id in LoadModuleTable -->
      <!--   (l)ine range: "beg-end" (inclusive range) -->
      <!--   (a)lien: whether frame is alien to enclosing P -->
      <!--   (str)uct: hpcstruct node id -->
      <!--   (v)ma-range-set: "{[beg-end), [beg-end)...}" -->
      <!ELEMENT PF (PF|Pr|L|C|S|M)*>
      <!ATTLIST PF
		i  CDATA #IMPLIED
		s  CDATA #IMPLIED
		n  CDATA #REQUIRED
		lm CDATA #IMPLIED
		f  CDATA #IMPLIED
		l  CDATA #IMPLIED
		str  CDATA #IMPLIED
		v  CDATA #IMPLIED>
      <!-- Procedure (static): GOAL: replace with 'P' -->
      <!ELEMENT Pr (Pr|L|C|S|M)*>
      <!ATTLIST Pr
                i  CDATA #IMPLIED
		s  CDATA #IMPLIED
                n  CDATA #REQUIRED
		lm CDATA #IMPLIED
		f  CDATA #IMPLIED
                l  CDATA #IMPLIED
		a  (1|0) "0"
		str  CDATA #IMPLIED
		v  CDATA #IMPLIED>
      <!-- Callsite (a special StatementRange) -->
      <!ELEMENT C (PF|M)*>
      <!ATTLIST C
		i CDATA #IMPLIED
		s CDATA #IMPLIED
		l CDATA #IMPLIED
		str CDATA #IMPLIED
		v CDATA #IMPLIED>

  <!-- ****************************************************************** -->
  <!-- Section: Flat profile						  -->
  <!-- ****************************************************************** -->
  <!ELEMENT SecFlatProfile (SecHeader, SecFlatProfileData)>
  <!ATTLIST SecFlatProfile
	    i CDATA #REQUIRED
	    n CDATA #REQUIRED>

    <!ELEMENT SecFlatProfileData (LM|M)*>
      <!-- Load module: (i)d; (n)ame; (v)ma-range-set -->
      <!ELEMENT LM (F|P|M)*>
      <!ATTLIST LM
                i CDATA #IMPLIED
                n CDATA #REQUIRED
		v CDATA #IMPLIED>
      <!-- File -->
      <!ELEMENT F (P|L|S|M)*>
      <!ATTLIST F
                i CDATA #IMPLIED
                n CDATA #REQUIRED>
      <!-- Procedure (Note 1) -->
      <!ELEMENT P (P|A|L|S|C|M)*>
      <!ATTLIST P
                i CDATA #IMPLIED
                n CDATA #REQUIRED
                l CDATA #IMPLIED
		str CDATA #IMPLIED
		v CDATA #IMPLIED>
      <!-- Alien (Note 1) -->
      <!ELEMENT A (A|L|S|C|M)*>
      <!ATTLIST A
                i CDATA #IMPLIED
                f CDATA #IMPLIED
                n CDATA #IMPLIED
                l CDATA #IMPLIED
		str CDATA #IMPLIED
		v CDATA #IMPLIED>
      <!-- Loop (Note 1,2) -->
      <!ELEMENT L (A|Pr|L|S|C|M)*>
      <!ATTLIST L
		i CDATA #IMPLIED
		s CDATA #IMPLIED
		l CDATA #IMPLIED
	        f CDATA #IMPLIED
		str CDATA #IMPLIED
		v CDATA #IMPLIED>
      <!-- Statement (Note 2) -->
      <!--   (it): trace record identifier -->
      <!ELEMENT S (S|M)*>
      <!ATTLIST S
		i  CDATA #IMPLIED
		it CDATA #IMPLIED
		s  CDATA #IMPLIED
		l  CDATA #IMPLIED
		str  CDATA #IMPLIED
		v  CDATA #IMPLIED>
      <!-- Note 1: Contained Cs may not contain PFs -->
      <!-- Note 2: The 's' attribute is not used for flat profiles -->
]>
<HPCToolkitExperiment version="2.2">
<Header n="driver">
  <Info/>
</Header>
<SecCallPathProfile i="0" n="driver">
<SecHeader>
  <MetricTable>
    <Metric i="2" n="CPUTIME (sec):Sum (I)" o="0" v="derived-incr" md="CPUTIME (sec)" em="0" es="0" ep="-9223372036854775808" t="inclusive" partner="3" show="1" show-percent="1">
      <MetricFormula t="combine" frm="sum($2, $2)"/>
      <MetricFormula t="finalize" frm="$2"/>
      <Info><NV n="units" v="events"/></Info>
    </Metric>
    <Metric i="3" n="CPUTIME (sec):Sum (E)" o="-1" v="derived-incr" md="CPUTIME (sec)" em="0" es="0" ep="-9223372036854775808" t="exclusive" partner="2" show="1" show-percent="1">
      <MetricFormula t="combine" frm="sum($3, $3)"/>
      <MetricFormula t="finalize" frm="$3"/>
      <Info><NV n="units" v="events"/></Info>
    </Metric>
  </MetricTable>
  <MetricDBTable>
    <MetricDB i="0" n="CPUTIME (sec) (I)" t="inclusive" partner="1" db-glob="*.metric-db" db-id="0" db-num-metrics="2" db-header-sz="24"/>
    <MetricDB i="1" n="CPUTIME (sec) (E)" t="exclusive" partner="0" db-glob="*.metric-db" db-id="1" db-num-metrics="2" db-header-sz="24"/>
  </MetricDBTable>
  <LoadModuleTable>
    <LoadModule i="2" n="/homes/cmsc714-1vef/cmsc714project-main-serial/lide_c_dnnlayers/test_c/singleCNN/driver"/>
    <LoadModule i="1686" n="/software/spack-software/2020.05.14/linux-rhel8-ivybridge/gcc-8.4.0/hpctoolkit-2020.03.01-wih3ztasqfu3d5hbfh6sl5j2ave3kcjt/lib/hpctoolkit/ext-libs/libmonitor.so.0.0.0"/>
    <LoadModule i="1690" n="/software/spack-software/2020.05.14/linux-rhel8-x86_64/gcc-rh8-8.3.1/gcc-8.4.0-vblibp6qsuo6rbkdn6femxo5kcfnwvry/lib64/libstdc++.so.6.0.25"/>
    <LoadModule i="1740" n="/usr/lib64/libc-2.28.so"/>
  </LoadModuleTable>
  <FileTable>
    <File i="3" n="./src/homes/cmsc714-1vef/cmsc714project-main-serial/lide_c_dnnlayers/actor/lide_c_conv2D.c"/>
    <File i="96" n="./src/homes/cmsc714-1vef/cmsc714project-main-serial/lide_c_dnnlayers/actor/lide_c_conv2DHead.c"/>
    <File i="189" n="./src/homes/cmsc714-1vef/cmsc714project-main-serial/lide_c_dnnlayers/actor/lide_c_flattenDense.c"/>
    <File i="280" n="./src/homes/cmsc714-1vef/cmsc714project-main-serial/lide_c_dnnlayers/actor/lide_c_read1D.c"/>
    <File i="339" n="./src/homes/cmsc714-1vef/cmsc714project-main-serial/lide_c_dnnlayers/graph/lide_c_singleCNN_graph.c"/>
    <File i="459" n="./src/homes/cmsc714-1vef/cmsc714project-main-serial/nn_c/cnn.c"/>
    <File i="582" n="./src/homes/cmsc714-1vef/cmsc714project-main-serial/nn_c/dense.c"/>
    <File i="713" n="./src/homes/cmsc714-1vef/cmsc714project-main-serial/nn_c/maxpool.c"/>
    <File i="762" n="./src/homes/cmsc714-1vef/cmsc714project-main-serial/nn_c/read1D.cpp"/>
    <File i="860" n="./src/homes/cmsc714-1vef/cmsc714project-main-serial/nn_c/relu.c"/>
    <File i="1332" n="&lt;unknown file&gt; [driver]"/>
    <File i="1687" n="&lt;unknown file&gt; [libmonitor.so.0.0.0]"/>
    <File i="1691" n="&lt;unknown file&gt; [libstdc++.so.6.0.25]"/>
    <File i="1741" n="getpt.c"/>
    <File i="1748" n="&lt;unknown file&gt; [libc-2.28.so]"/>
  </FileTable>
  <ProcedureTable>
    <Procedure i="44" n="lide_c_conv2d_invoke(_lide_c_conv2d_context_struct*)" v="0x402495"/>
    <Procedure i="137" n="lide_c_conv2DHead_invoke(_lide_c_conv2DHead_context_struct*)" v="0x4028c8"/>
    <Procedure i="228" n="lide_c_flattenDense_invoke(_lide_c_flattenDense_context_struct*)" v="0x403092"/>
    <Procedure i="309" n="lide_c_read1D_invoke(_lide_c_read1D_context_struct*)" v="0x403688"/>
    <Procedure i="453" n="lide_c_singleCNN_graph_scheduler(_lide_c_singleCNN_graph_context_struct*)" v="0x4020ec"/>
    <Procedure i="490" n="addBias(unsigned int, unsigned int, unsigned int, float*, float*)" v="0x404328"/>
    <Procedure i="507" n="inferencePicLev(float*, float*, float*, unsigned int, unsigned int, unsigned int)" v="0x404450"/>
    <Procedure i="524" n="inferencePicPickNonHead(float*, float*, float*, unsigned int, unsigned int, unsigned int, unsigned int, unsigned int, unsigned int)" v="0x404589"/>
    <Procedure i="541" n="inferencePicPickHead(float*, float*, float*, unsigned int, unsigned int, unsigned int, unsigned int, unsigned int)" v="0x4046ba"/>
    <Procedure i="555" n="cnnRun(float*, float*, float*, float*, unsigned int, unsigned int, unsigned int, unsigned int, unsigned int, unsigned int)" v="0x4047a3"/>
    <Procedure i="562" n="cnnRunNonHead(float*, float*, float*, float*, unsigned int, unsigned int, unsigned int, unsigned int, unsigned int, unsigned int)" v="0x40480c"/>
    <Procedure i="625" n="forward(unsigned int, float*, float*, float*, unsigned int, unsigned int, unsigned int)" v="0x404ae3"/>
    <Procedure i="668" n="denserun(DENSESTATE*, unsigned int, unsigned int, float*, unsigned int, unsigned int)" v="0x404e05"/>
    <Procedure i="714" n="maxpooling(unsigned int, float*, unsigned int, unsigned int, float*, unsigned int)" v="0x404fda"/>
    <Procedure i="749" n="maxpool(float*, MAXPOOLSTATE*, unsigned int, unsigned int, unsigned int)" v="0x405207"/>
    <Procedure i="774" n="Read1D::readExecute()" v="0x405320"/>
    <Procedure i="861" n="relu(unsigned int, unsigned int, float*)" v="0x4062a1"/>
    <Procedure i="883" n="reluCnn(float*, unsigned int, unsigned int, unsigned int)" v="0x4063dc"/>
    <Procedure i="1426" n="main" v="0x401842"/>
    <Procedure i="1440" n="lide_c_util_guarded_execution" v="0x4021cd"/>
    <Procedure i="1444" n="lide_c_util_simple_scheduler" v="0x402211"/>
    <Procedure i="1492" n="lide_c_maxpool_invoke(_lide_c_maxpool_context_struct*)" v="0x4033de"/>
    <Procedure i="1515" n="lide_c_reluCnn_invoke(_lide_c_reluCnn_context_struct*)" v="0x403882"/>
    <Procedure i="1688" n="&lt;program root&gt;" f="1" v="0"/>
    <Procedure i="1692" n="std::getline&lt;char, std::char_traits&lt;char&gt;, std::allocator&lt;char&gt; &gt;(std::basic_istream&lt;char, std::char_traits&lt;char&gt; &gt;&amp;, std::__cxx11::basic_string&lt;char, std::char_traits&lt;char&gt;, std::allocator&lt;char&gt; &gt;&amp;, char)" v="0"/>
    <Procedure i="1694" n="std::__cxx11::basic_stringstream&lt;char, std::char_traits&lt;char&gt;, std::allocator&lt;char&gt; &gt;::basic_stringstream(std::__cxx11::basic_string&lt;char, std::char_traits&lt;char&gt;, std::allocator&lt;char&gt; &gt; const&amp;, std::_Ios_Openmode)" v="0"/>
    <Procedure i="1696" n="std::locale::locale()" v="0"/>
    <Procedure i="1698" n="std::ios_base::ios_base()" v="0"/>
    <Procedure i="1700" n="std::basic_ios&lt;char, std::char_traits&lt;char&gt; &gt;::init(std::basic_streambuf&lt;char, std::char_traits&lt;char&gt; &gt;*)" v="0"/>
    <Procedure i="1702" n="std::ios_base::_M_init()" v="0"/>
    <Procedure i="1704" n="std::locale::~locale()" v="0"/>
    <Procedure i="1706" n="std::basic_ios&lt;char, std::char_traits&lt;char&gt; &gt;::_M_cache_locale(std::locale const&amp;)" v="0"/>
    <Procedure i="1708" n="std::has_facet&lt;std::ctype&lt;char&gt; &gt;(std::locale const&amp;)" v="0"/>
    <Procedure i="1710" n="__dynamic_cast" v="0"/>
    <Procedure i="1712" n="std::use_facet&lt;std::num_get&lt;char, std::istreambuf_iterator&lt;char, std::char_traits&lt;char&gt; &gt; &gt; &gt;(std::locale const&amp;)" v="0"/>
    <Procedure i="1714" n="std::use_facet&lt;std::num_put&lt;char, std::ostreambuf_iterator&lt;char, std::char_traits&lt;char&gt; &gt; &gt; &gt;(std::locale const&amp;)" v="0"/>
    <Procedure i="1716" n="std::locale::id::_M_id() const" v="0"/>
    <Procedure i="1718" n="std::has_facet&lt;std::num_get&lt;char, std::istreambuf_iterator&lt;char, std::char_traits&lt;char&gt; &gt; &gt; &gt;(std::locale const&amp;)" v="0"/>
    <Procedure i="1720" n="std::locale::_Impl::_Impl(unsigned long)" v="0"/>
    <Procedure i="1722" n="std::use_facet&lt;std::ctype&lt;char&gt; &gt;(std::locale const&amp;)" v="0"/>
    <Procedure i="1724" n="__cxxabiv1::__vmi_class_type_info::__do_dyncast(long, __cxxabiv1::__class_type_info::__sub_kind, __cxxabiv1::__class_type_info const*, void const*, __cxxabiv1::__class_type_info const*, void const*, __cxxabiv1::__class_type_info::__dyncast_result&amp;) const" v="0"/>
    <Procedure i="1726" n="std::basic_istream&lt;char, std::char_traits&lt;char&gt; &gt;::_M_extract&lt;float&gt;(float&amp;)" v="0"/>
    <Procedure i="1728" n="std::num_get&lt;char, std::istreambuf_iterator&lt;char, std::char_traits&lt;char&gt; &gt; &gt;::do_get(std::istreambuf_iterator&lt;char, std::char_traits&lt;char&gt; &gt;, std::istreambuf_iterator&lt;char, std::char_traits&lt;char&gt; &gt;, std::ios_base&amp;, std::_Ios_Iostate&amp;, float&amp;) const" v="0"/>
    <Procedure i="1730" n="std::num_get&lt;char, std::istreambuf_iterator&lt;char, std::char_traits&lt;char&gt; &gt; &gt;::_M_extract_float(std::istreambuf_iterator&lt;char, std::char_traits&lt;char&gt; &gt;, std::istreambuf_iterator&lt;char, std::char_traits&lt;char&gt; &gt;, std::ios_base&amp;, std::_Ios_Iostate&amp;, std::basic_string&lt;char, std::char_traits&lt;char&gt;, std::allocator&lt;char&gt; &gt;&amp;) const" v="0"/>
    <Procedure i="1732" n="std::basic_string&lt;char, std::char_traits&lt;char&gt;, std::allocator&lt;char&gt; &gt;::push_back(char)" v="0"/>
    <Procedure i="1734" n="std::collate&lt;char&gt;::do_compare(char const*, char const*, char const*, char const*) const" v="0"/>
    <Procedure i="1736" n="std::__convert_to_v&lt;float&gt;(char const*, float&amp;, std::_Ios_Iostate&amp;, __locale_struct* const&amp;)" v="0"/>
    <Procedure i="1738" n="std::basic_string&lt;char, std::char_traits&lt;char&gt;, std::allocator&lt;char&gt; &gt;::_Rep::_M_destroy(std::allocator&lt;char&gt; const&amp;)" v="0"/>
    <Procedure i="1742" n="__GI_____strtof_l_internal" v="0"/>
    <Procedure i="1744" n="round_and_return" v="0"/>
    <Procedure i="1746" n="round_away" v="0"/>
    <Procedure i="1749" n="free" v="0"/>
  </ProcedureTable>
  <Info/>
</SecHeader>
<SecCallPathProfileData>
<M n="2" v="0.532981"/>
<PF i="2" s="1688" l="0" lm="1686" f="1687" n="1688">
<M n="2" v="0.532981"/>
<C i="3" s="1689" l="0" v="0xdaca">
<M n="2" v="0.532981"/>
<PF i="4" s="1426" l="0" lm="2" f="1332" n="1426">
<M n="2" v="0.532981"/>
<C i="5" s="1429" l="0" v="0x401912">
<M n="2" v="0.532981"/>
<PF i="6" s="453" l="228" lm="2" f="339" n="453">
<M n="2" v="0.532981"/>
<C i="7" s="458" l="229" v="0x402118">
<M n="2" v="0.532981"/>
<PF i="8" s="1444" l="0" lm="2" f="1332" n="1444">
<M n="2" v="0.532981"/>
<L i="9" s="1446" l="0" f="1332" v="0x402232">
<M n="2" v="0.532981"/>
<L i="10" s="1448" l="0" f="1332" v="0x402282">
<M n="2" v="0.532981"/>
<C i="11" s="1450" l="0" v="0x40227b">
<M n="2" v="0.532981"/>
<PF i="12" s="1440" l="0" lm="2" f="1332" n="1440">
<M n="2" v="0.532981"/>
<C i="13" s="1443" l="0" v="0x402203">
<M n="2" v="0.532981"/>
<PF i="14" s="44" l="124" lm="2" f="3" n="44">
<M n="2" v="0.209494"/>
<C i="15" s="85" l="159" v="0x402669">
<M n="2" v="0.209494"/>
<PF i="16" s="562" l="136" lm="2" f="459" n="562">
<M n="2" v="0.209494"/>
<C i="17" s="567" l="143" v="0x404857">
<M n="2" v="0.209494"/>
<PF i="18" s="524" l="87" lm="2" f="459" n="524">
<M n="2" v="0.209494"/><M n="3" v="0.005986"/>
<L i="19" s="528" l="91" f="459" v="0x4045af">
<M n="2" v="0.209494"/>
<L i="20" s="531" l="92" f="459" v="0x4045c2">
<M n="2" v="0.209494"/>
<L i="21" s="534" l="93" f="459" v="0x4045d5">
<M n="2" v="0.209494"/><M n="3" v="0.005986"/>
<S i="22" s="536" l="95">
<M n="2" v="0.005986"/><M n="3" v="0.005986"/>
</S>
<C i="23" s="540" l="100" v="0x40469c">
<M n="2" v="0.203508"/>
<PF i="24" s="507" l="70" lm="2" f="459" n="507">
<M n="2" v="0.203508"/><M n="3" v="0.203508"/>
<L i="25" s="511" l="73" f="459" v="0x404472">
<M n="2" v="0.203508"/><M n="3" v="0.005986"/>
<S i="26" s="512" l="73">
<M n="2" v="0.005986"/><M n="3" v="0.005986"/>
</S>
<L i="27" s="514" l="74" f="459" v="0x404485">
<M n="2" v="0.197522"/><M n="3" v="0.005988"/>
<S i="28" s="516" l="75">
<M n="2" v="0.005988"/><M n="3" v="0.005988"/>
</S>
<L i="29" s="517" l="75" f="459" v="0x404498">
<M n="2" v="0.191534"/><M n="3" v="0.011975"/>
<S i="30" s="518" l="75">
<M n="2" v="0.005988"/><M n="3" v="0.005988"/>
</S>
<S i="31" s="519" l="76">
<M n="2" v="0.005987"/><M n="3" v="0.005987"/>
</S>
<L i="32" s="520" l="76" f="459" v="0x4044ab">
<M n="2" v="0.179559"/><M n="3" v="0.179559"/>
<S i="33" s="521" l="76">
<M n="2" v="0.023951"/><M n="3" v="0.023951"/>
</S>
<S i="34" s="522" l="77">
<M n="2" v="0.113753"/><M n="3" v="0.113753"/>
</S>
<S i="35" s="523" l="78">
<M n="2" v="0.041855"/><M n="3" v="0.041855"/>
</S>
</L>
</L>
</L>
</L>
</PF>
</C>
</L>
</L>
</L>
</PF>
</C>
</PF>
</C>
</PF>
<PF i="36" s="137" l="123" lm="2" f="96" n="137">
<M n="2" v="0.083713"/>
<C i="37" s="178" l="158" v="0x402ac5">
<M n="2" v="0.083713"/>
<PF i="38" s="555" l="121" lm="2" f="459" n="555">
<M n="2" v="0.083713"/>
<C i="39" s="560" l="126" v="0x4047ea">
<M n="2" v="0.071761"/>
<PF i="40" s="541" l="107" lm="2" f="459" n="541">
<M n="2" v="0.071761"/>
<L i="41" s="545" l="111" f="459" v="0x4046e0">
<M n="2" v="0.071761"/>
<L i="42" s="548" l="112" f="459" v="0x4046f3">
<M n="2" v="0.071761"/>
<C i="43" s="554" l="116" v="0x40478e">
<M n="2" v="0.071761"/>
<PF i="44" s="507" l="70" lm="2" f="459" n="507">
<M n="2" v="0.071761"/><M n="3" v="0.071761"/>
<L i="45" s="511" l="73" f="459" v="0x404472">
<M n="2" v="0.071761"/><M n="3" v="0.005986"/>
<S i="46" s="512" l="73">
<M n="2" v="0.005986"/><M n="3" v="0.005986"/>
</S>
<L i="47" s="514" l="74" f="459" v="0x404485">
<M n="2" v="0.065775"/><M n="3" v="0.005984"/>
<S i="48" s="515" l="74">
<M n="2" v="0.005984"/><M n="3" v="0.005984"/>
</S>
<L i="49" s="517" l="75" f="459" v="0x404498">
<M n="2" v="0.059791"/><M n="3" v="0.005914"/>
<S i="50" s="518" l="75">
<M n="2" v="0.005914"/><M n="3" v="0.005914"/>
</S>
<L i="51" s="520" l="76" f="459" v="0x4044ab">
<M n="2" v="0.053877"/><M n="3" v="0.053877"/>
<S i="52" s="522" l="77">
<M n="2" v="0.023939"/><M n="3" v="0.023939"/>
</S>
<S i="53" s="523" l="78">
<M n="2" v="0.029938"/><M n="3" v="0.029938"/>
</S>
</L>
</L>
</L>
</L>
</PF>
</C>
</L>
</L>
</PF>
</C>
<C i="54" s="561" l="128" v="0x404809">
<M n="2" v="0.011952"/>
<PF i="55" s="490" l="51" lm="2" f="459" n="490">
<M n="2" v="0.011952"/><M n="3" v="0.011952"/>
<L i="56" s="494" l="53" f="459" v="0x404344">
<M n="2" v="0.011952"/>
<L i="57" s="498" l="55" f="459" v="0x404374">
<M n="2" v="0.011952"/>
<L i="58" s="501" l="56" f="459" v="0x404387">
<M n="2" v="0.011952"/>
<L i="59" s="504" l="57" f="459" v="0x40439a">
<M n="2" v="0.011952"/><M n="3" v="0.011952"/>
<S i="60" s="506" l="58">
<M n="2" v="0.011952"/><M n="3" v="0.011952"/>
</S>
</L>
</L>
</L>
</L>
</PF>
</C>
</PF>
</C>
</PF>
<PF i="61" s="228" l="118" lm="2" f="189" n="228">
<M n="2" v="0.053833"/>
<C i="62" s="269" l="156" v="0x403228">
<M n="2" v="0.053833"/>
<PF i="63" s="668" l="105" lm="2" f="582" n="668">
<M n="2" v="0.053833"/>
<C i="64" s="673" l="110" v="0x404e4c">
<M n="2" v="0.053833"/>
<PF i="65" s="625" l="54" lm="2" f="582" n="625">
<M n="2" v="0.053833"/><M n="3" v="0.053833"/>
<L i="66" s="630" l="57" f="582" v="0x404b0e">
<M n="2" v="0.053833"/>
<L i="67" s="633" l="58" f="582" v="0x404b21">
<M n="2" v="0.053833"/>
<L i="68" s="636" l="59" f="582" v="0x404b3c">
<M n="2" v="0.053833"/>
<L i="69" s="639" l="60" f="582" v="0x404b4f">
<M n="2" v="0.053833"/><M n="3" v="0.053833"/>
<S i="70" s="641" l="61">
<M n="2" v="0.047844"/><M n="3" v="0.047844"/>
</S>
<S i="71" s="642" l="62">
<M n="2" v="0.005989"/><M n="3" v="0.005989"/>
</S>
</L>
</L>
</L>
</L>
</PF>
</C>
</PF>
</C>
</PF>
<PF i="72" s="309" l="84" lm="2" f="280" n="309">
<M n="2" v="0.150134"/>
<C i="73" s="322" l="91" v="0x4036d0">
<M n="2" v="0.150134"/>
<PF i="74" s="774" l="16" lm="2" f="762" n="774">
<M n="2" v="0.150134"/>
<L i="75" s="807" l="25" f="762" v="0x4053f0">
<M n="2" v="0.150134"/>
<L i="76" s="818" l="28" f="762" v="0x40545f">
<M n="2" v="0.150134"/>
<C i="77" s="827" l="29" v="0x405498">
<M n="2" v="0.005914"/>
<PF i="78" s="1692" l="0" lm="1690" f="1691" n="1692">
<M n="2" v="0.005914"/><M n="3" v="0.005914"/>
<S i="79" s="1693" l="0">
<M n="2" v="0.005914"/><M n="3" v="0.005914"/>
</S>
</PF>
</C>
<C i="80" s="829" l="30" v="0x4054c2">
<M n="2" v="0.078614"/>
<PF i="81" s="1694" l="0" lm="1690" f="1691" n="1694">
<M n="2" v="0.078614"/>
<C i="82" s="1695" l="0" v="0x11daad">
<M n="2" v="0.011951"/>
<PF i="83" s="1696" l="0" lm="1690" f="1691" n="1696">
<M n="2" v="0.005966"/><M n="3" v="0.005966"/>
<S i="84" s="1697" l="0">
<M n="2" v="0.005966"/><M n="3" v="0.005966"/>
</S>
</PF>
<PF i="85" s="1698" l="0" lm="1690" f="1691" n="1698">
<M n="2" v="0.005985"/><M n="3" v="0.005985"/>
<S i="86" s="1699" l="0">
<M n="2" v="0.005985"/><M n="3" v="0.005985"/>
</S>
</PF>
</C>
<C i="87" s="1695" l="0" v="0x11db0d">
<M n="2" v="0.031537"/>
<PF i="88" s="1700" l="0" lm="1690" f="1691" n="1700">
<M n="2" v="0.031537"/>
<C i="89" s="1701" l="0" v="0xfbfb1">
<M n="2" v="0.005967"/>
<PF i="90" s="1702" l="0" lm="1690" f="1691" n="1702">
<M n="2" v="0.005967"/>
<C i="91" s="1703" l="0" v="0xaaf54">
<M n="2" v="0.005967"/>
<PF i="92" s="1704" l="0" lm="1690" f="1691" n="1704">
<M n="2" v="0.005967"/><M n="3" v="0.005967"/>
<S i="93" s="1705" l="0">
<M n="2" v="0.005967"/><M n="3" v="0.005967"/>
</S>
</PF>
</C>
</PF>
</C>
<C i="94" s="1701" l="0" v="0xfbfc0">
<M n="2" v="0.02557"/>
<PF i="95" s="1706" l="0" lm="1690" f="1691" n="1706">
<M n="2" v="0.02557"/><M n="3" v="0.005936"/>
<C i="96" s="1707" l="0" v="0xfbb94">
<M n="2" v="0.013716"/>
<PF i="97" s="1708" l="0" lm="1690" f="1691" n="1708">
<M n="2" v="0.013716"/><M n="3" v="0.005863"/>
<C i="98" s="1709" l="0" v="0x108060">
<M n="2" v="0.007853"/>
<PF i="99" s="1710" l="0" lm="1690" f="1691" n="1710">
<M n="2" v="0.007853"/><M n="3" v="0.007853"/>
<S i="100" s="1711" l="0">
<M n="2" v="0.007853"/><M n="3" v="0.007853"/>
</S>
</PF>
</C>
<S i="101" s="1709" l="0">
<M n="2" v="0.005863"/><M n="3" v="0.005863"/>
</S>
</PF>
</C>
<C i="102" s="1707" l="0" v="0xfbbd6">
<M n="2" v="0.005918"/>
<PF i="103" s="1712" l="0" lm="1690" f="1691" n="1712">
<M n="2" v="0.005918"/>
<C i="104" s="1713" l="0" v="0x10719b">
<M n="2" v="0.005918"/>
<PF i="105" s="1710" l="0" lm="1690" f="1691" n="1710">
<M n="2" v="0.005918"/><M n="3" v="0.005918"/>
<S i="106" s="1711" l="0">
<M n="2" v="0.005918"/><M n="3" v="0.005918"/>
</S>
</PF>
</C>
</PF>
</C>
<S i="107" s="1707" l="0">
<M n="2" v="0.005936"/><M n="3" v="0.005936"/>
</S>
</PF>
</C>
</PF>
</C>
<C i="108" s="1695" l="0" v="0x11db2d">
<M n="2" v="0.011943"/>
<PF i="109" s="1700" l="0" lm="1690" f="1691" n="1700">
<M n="2" v="0.011943"/>
<C i="110" s="1701" l="0" v="0xfbfc0">
<M n="2" v="0.011943"/>
<PF i="111" s="1706" l="0" lm="1690" f="1691" n="1706">
<M n="2" v="0.011943"/>
<C i="112" s="1707" l="0" v="0xfbbbb">
<M n="2" v="0.005984"/>
<PF i="113" s="1714" l="0" lm="1690" f="1691" n="1714">
<M n="2" v="0.005984"/>
<C i="114" s="1715" l="0" v="0x107120">
<M n="2" v="0.005984"/>
<PF i="115" s="1716" l="0" lm="1690" f="1691" n="1716">
<M n="2" v="0.005984"/><M n="3" v="0.005984"/>
<S i="116" s="1717" l="0">
<M n="2" v="0.005984"/><M n="3" v="0.005984"/>
</S>
</PF>
</C>
</PF>
</C>
<C i="117" s="1707" l="0" v="0xfbbca">
<M n="2" v="0.005959"/>
<PF i="118" s="1718" l="0" lm="1690" f="1691" n="1718">
<M n="2" v="0.005959"/>
<C i="119" s="1719" l="0" v="0x1081f0">
<M n="2" v="0.005959"/>
<PF i="120" s="1710" l="0" lm="1690" f="1691" n="1710">
<M n="2" v="0.005959"/><M n="3" v="0.005959"/>
<S i="121" s="1711" l="0">
<M n="2" v="0.005959"/><M n="3" v="0.005959"/>
</S>
</PF>
</C>
</PF>
</C>
</PF>
</C>
</PF>
</C>
<C i="122" s="1695" l="0" v="0x11dba2">
<M n="2" v="0.005912"/>
<PF i="123" s="1696" l="0" lm="1690" f="1691" n="1696">
<M n="2" v="0.005912"/>
<C i="124" s="1697" l="0" v="0xad5a9">
<M n="2" v="0.005912"/>
<PF i="125" s="1720" l="0" lm="1690" f="1691" n="1720">
<M n="2" v="0.005912"/><M n="3" v="0.005912"/>
<S i="126" s="1721" l="0">
<M n="2" v="0.005912"/><M n="3" v="0.005912"/>
</S>
</PF>
</C>
</PF>
</C>
<C i="127" s="1695" l="0" v="0x11dbfc">
<M n="2" v="0.017271"/>
<PF i="128" s="1700" l="0" lm="1690" f="1691" n="1700">
<M n="2" v="0.017271"/>
<C i="129" s="1701" l="0" v="0xfbfc0">
<M n="2" v="0.017271"/>
<PF i="130" s="1706" l="0" lm="1690" f="1691" n="1706">
<M n="2" v="0.017271"/><M n="3" v="0.005982"/>
<C i="131" s="1707" l="0" v="0xfbba0">
<M n="2" v="0.011289"/>
<PF i="132" s="1722" l="0" lm="1690" f="1691" n="1722">
<M n="2" v="0.011289"/>
<C i="133" s="1723" l="0" v="0x1065cb">
<M n="2" v="0.011289"/>
<PF i="134" s="1710" l="0" lm="1690" f="1691" n="1710">
<M n="2" v="0.011289"/><M n="3" v="0.005353"/>
<C i="135" s="1711" l="0" v="0x98e26">
<M n="2" v="0.005936"/>
<PF i="136" s="1724" l="0" lm="1690" f="1691" n="1724">
<M n="2" v="0.005936"/><M n="3" v="0.005936"/>
<S i="137" s="1725" l="0">
<M n="2" v="0.005936"/><M n="3" v="0.005936"/>
</S>
</PF>
</C>
<S i="138" s="1711" l="0">
<M n="2" v="0.005353"/><M n="3" v="0.005353"/>
</S>
</PF>
</C>
</PF>
</C>
<S i="139" s="1707" l="0">
<M n="2" v="0.005982"/><M n="3" v="0.005982"/>
</S>
</PF>
</C>
</PF>
</C>
</PF>
</C>
<C i="140" s="831" l="32" v="0x4054db">
<M n="2" v="0.065606"/>
<PF i="141" s="1726" l="0" lm="1690" f="1691" n="1726">
<M n="2" v="0.065606"/>
<C i="142" s="1727" l="0" v="0x100760">
<M n="2" v="0.065606"/>
<PF i="143" s="1728" l="0" lm="1690" f="1691" n="1728">
<M n="2" v="0.065606"/>
<C i="144" s="1729" l="0" v="0x10d507">
<M n="2" v="0.029836"/>
<PF i="145" s="1730" l="0" lm="1690" f="1691" n="1730">
<M n="2" v="0.029836"/><M n="3" v="0.005953"/>
<C i="146" s="1731" l="0" v="0x10cb49">
<M n="2" v="0.005966"/>
<PF i="147" s="1732" l="0" lm="1690" f="1691" n="1732">
<M n="2" v="0.005966"/><M n="3" v="0.005966"/>
<S i="148" s="1733" l="0">